{
  "$schema": "../../../schemas/ghos_defect_ledger.schema.json",
  "schema_version": "1.0.0",
  "work_package": "GCL-GHOS-CONTROL-PLANE-REMEDIATION-001",
  "fixed_before_reconciliation": true,
  "findings": [
    {
      "id": "GCL-GHOS-DEFECT-001",
      "category": "SPECIFICATION_DEFECT",
      "title": "Incomplete workflow-continuity contract",
      "status": "CONFIRMED_REQUIREMENTS_GAP",
      "earliest_detectable": "Original 0.1.x design; unmistakable during the 0.2.0 review on 2026-08-25.",
      "evidence": ["No required durable open transaction, settled gates, permitted transitions, replacement recovery, or executor classification."],
      "control_expectation": {"prevent":"capability and topology review","detect":"cold-resume and replacement tests","contain":"limit claims to bounded diagnostic continuity","recover":"reconstruct state and transition from protected records"},
      "consequence": "A durable institutional ledger surrounded an implicit conversational scheduler.",
      "waste_or_risk": ["rediscovery","ambiguous resume","wrong transition","summary dependence"],
      "originating_assistant_contribution": "MATERIAL",
      "existing_controls_should_have_prevented": "NO_MECHANICAL_CONTROL; DESIGN_REVIEW_SHOULD_HAVE_DETECTED",
      "confidence": "HIGH"
    },
    {
      "id": "GCL-GHOS-DEFECT-002",
      "category": "IMPLEMENTATION_DEFECT",
      "title": "No independent regression against the literal 0.2.0 implementation contract",
      "status": "NOT_CONFIRMED_AS_IMPLEMENTATION_NONCONFORMANCE",
      "earliest_detectable": "Specification review.",
      "evidence": ["PR #52 implemented the narrower bounded-recovery invariant it declared; universal crash recovery was not specified."],
      "control_expectation": {"prevent":"do not overstate implemented semantics","detect":"separate omitted requirements from code nonconformance","contain":"bound operational claims","recover":"govern the missing requirement separately"},
      "consequence": "Calling this only an implementation bug would conceal the requirements defect.",
      "waste_or_risk": ["misallocated remediation","unnecessary churn"],
      "originating_assistant_contribution": "MATERIAL_OVERSTATEMENT",
      "existing_controls_should_have_prevented": "NOT_APPLICABLE_AS_LITERAL_NONCONFORMANCE",
      "confidence": "HIGH"
    },
    {
      "id": "GCL-GHOS-DEFECT-003",
      "category": "ENFORCEMENT_DEFECT",
      "title": "Continuity remained prose-level",
      "status": "CONFIRMED",
      "earliest_detectable": "PR #52 validator and test design.",
      "evidence": ["Validators check phrases and immutable identity, not interruption, replacement, or incomplete-transaction behavior."],
      "control_expectation": {"prevent":"pair behavioral claims with executable acceptance","detect":"exercise interruption and stale-state scenarios","contain":"describe green CI narrowly","recover":"require durable state at invocation end"},
      "consequence": "Green CI proved documentary integrity, not crash-recoverable execution.",
      "waste_or_risk": ["false confidence","undetected behavioral failure","operator-discipline dependence"],
      "originating_assistant_contribution": "MATERIAL",
      "existing_controls_should_have_prevented": "NO; CONTROLS_TARGETED_ARTIFACT_INTEGRITY",
      "confidence": "HIGH"
    },
    {
      "id": "GCL-GHOS-DEFECT-004",
      "category": "ADOPTION_OR_PROPAGATION_DEFECT",
      "title": "0.2.0 adoption omitted dependent current-state surfaces",
      "status": "CONFIRMED",
      "earliest_detectable": "PR #54 candidate diff before merge on 2026-08-25.",
      "evidence": ["PR #54 changed adoption/schema/tests but omitted status JSON, README, status coherence, and MATH-PROGRAMME guide."],
      "control_expectation": {"prevent":"declare propagation consumers","detect":"compare authoritative and projected current state","contain":"keep completion obligation open","recover":"apply authority precedence"},
      "consequence": "Protected sources answer the effective-version question differently.",
      "waste_or_risk": ["reconstruction","superseded policy use","wrong operation","remediation cost"],
      "originating_assistant_contribution": "DIRECT_AND_SUBSTANTIAL",
      "existing_controls_should_have_prevented": "YES_IN_POLICY; NOT_ENFORCED",
      "confidence": "VERY_HIGH"
    },
    {
      "id": "GCL-GHOS-DEFECT-005",
      "category": "VALIDATOR_DEFECT",
      "title": "Status coherence accepted a stale self-consistent snapshot",
      "status": "CONFIRMED",
      "earliest_detectable": "Validator design; activated by PR #54.",
      "evidence": ["ci/status_coherence.py validates evidence selected inside the 0.1.1 projection and does not compare the live adoption path."],
      "control_expectation": {"prevent":"anchor selection to authoritative current path","detect":"fail live-versus-projection mismatch","contain":"emit a blocking contradiction","recover":"name authority and stale source"},
      "consequence": "Status-coherence success did not establish current coherence.",
      "waste_or_risk": ["false-green CI","incorrect completion","delayed detection","stale operation"],
      "originating_assistant_contribution": "MATERIAL",
      "existing_controls_should_have_prevented": "YES; THIS WAS THE CONTROL'S DECLARED PURPOSE",
      "confidence": "VERY_HIGH"
    },
    {
      "id": "GCL-GHOS-DEFECT-006",
      "category": "OPERATING_PROCEDURE_DEFECT",
      "title": "Diagnostic recovery omitted durable cross-session resumption",
      "status": "CONFIRMED_SCOPE_GAP",
      "earliest_detectable": "MATH-PROGRAMME PR #681 review.",
      "evidence": ["The guide defines diagnostic/replay ladders but not open-transaction, termination, replacement, or coordinator recovery state."],
      "control_expectation": {"prevent":"state scope boundary","detect":"test replacement without chat","contain":"never leave next transition only in chat","recover":"identify complete/incomplete work from protected state"},
      "consequence": "Continuation could still depend on one bounded invocation.",
      "waste_or_risk": ["large chat checkpoints","repeated diagnostics","ambiguous partial work"],
      "originating_assistant_contribution": "DIRECT",
      "existing_controls_should_have_prevented": "NO_EXECUTABLE_CONTROL; REVIEW_SHOULD_HAVE_DETECTED_SCOPE",
      "confidence": "HIGH"
    },
    {
      "id": "GCL-GHOS-DEFECT-007",
      "category": "EXECUTOR_CAPABILITY_MISMATCH",
      "title": "No executor-topology admission",
      "status": "CONFIRMED",
      "earliest_detectable": "Before admitting long-running externally gated work; certainly before 0.2.0.",
      "evidence": ["No rule derives executor suitability from persistence, external waits, role graph, or transaction topology."],
      "control_expectation": {"prevent":"classify topology before execution","detect":"reject persistence mismatch","contain":"do not make a bounded agent sole scheduler","recover":"resume with a suitable executor"},
      "consequence": "Agents undertook workflows whose completion horizon they could not guarantee.",
      "waste_or_risk": ["polling","rediscovery","unfulfillable commitments","unclear pending ownership"],
      "originating_assistant_contribution": "STRONGLY_SUPPORTED",
      "existing_controls_should_have_prevented": "NO; ADMISSION_CONTROL_ABSENT",
      "confidence": "HIGH"
    },
    {
      "id": "GCL-GHOS-DEFECT-008",
      "category": "EXTERNAL_PLATFORM_LIMITATION",
      "title": "Bounded conversation is a known constraint, not a GitHub persistence failure",
      "status": "CONFIRMED_CONSTRAINT",
      "earliest_detectable": "Before GH-OS design.",
      "evidence": ["GitHub preserved protected commits, checks, reviews, admission, and adoption; conversational persistence remained unavailable."],
      "control_expectation": {"prevent":"treat bounded execution as fixed constraint","detect":"admit compatible work only","contain":"avoid sole conversational controller","recover":"replace from durable state"},
      "consequence": "Future execution commitments exceeded guaranteed executor capability.",
      "waste_or_risk": ["abandoned waits","repeated polling","overpromising"],
      "originating_assistant_contribution": "MATERIAL",
      "existing_controls_should_have_prevented": "ARCHITECTURE_SHOULD_HAVE_ACCOMMODATED",
      "confidence": "HIGH"
    },
    {
      "id": "GCL-GHOS-DEFECT-009",
      "category": "DOCUMENTATION_OR_PROJECTION_DRIFT",
      "title": "Protected projections disagree with active 0.2.0 adoption",
      "status": "CONFIRMED",
      "earliest_detectable": "PR #54 preparation and immediate protected readback.",
      "evidence": ["Adoption says 0.2.0; status JSON says 0.1.1; README, standard front matter, ADR, and programme guide remain stale."],
      "control_expectation": {"prevent":"declare all current-version consumers","detect":"cross-path and cross-repository coherence","contain":"mark stale lower authority","recover":"use authoritative adoption precedence"},
      "consequence": "Fresh operators may select superseded authority from protected documentation.",
      "waste_or_risk": ["wrong-version operation","reconstruction","conflicting audits","trust loss"],
      "originating_assistant_contribution": "DIRECT",
      "existing_controls_should_have_prevented": "YES_IN_POLICY; INSUFFICIENT_ENFORCEMENT",
      "confidence": "VERY_HIGH"
    },
    {
      "id": "GCL-GHOS-DEFECT-010",
      "category": "HUMAN_OR_AGENT_GOVERNANCE_PROCESS_DEFECT",
      "title": "Actor separation is not fully attributable in durable evidence",
      "status": "CONFIRMED_EVIDENCE_GAP",
      "earliest_detectable": "PR #54 merge gate and again before PR #57 merge.",
      "evidence": ["PR #54 has no review; fyremael is author and merger. PR #57 has exact-head approval by jimsteeg but fyremael is author and merger; shared identity cannot prove human-versus-agent actor."],